{
  "format": "wiretruth.observation/v1",
  "library": {"name": "litellm", "version": "1.103.1", "language": "python", "api": "litellm.completion"},
  "outcome": "returned",
  "unsupported_reason": null,
  "error": null,
  "finish": {"value": "length", "raw": "length", "surface": "primary", "source": "choices[0].finish_reason"},
  "text": {"value": "Kyiv, one of the oldest cities in Eastern Europe, was founded", "surface": "primary"},
  "structured": {"attempted": false, "returned_as_success": false, "value": null},
  "tool_calls": [
    {"id": "call_1", "name": "get_weather", "arguments_raw": "{\"city\": \"Kyiv\"}", "arguments_parsed_ok": true, "arguments": {"city": "Kyiv"}}
  ],
  "usage": {
    "input": 21, "cached_input": null, "output": 16, "reasoning": null, "total": 37,
    "surface": {"input": "primary", "cached_input": "absent", "output": "primary", "reasoning": "absent", "total": "primary"}
  },
  "stream": {"used": true, "completed": true, "chunks_seen": 9},
  "notes": [],
  "elapsed_ms": 42
}
